source,author,title,description,url,urlToImage,publishedAt,content
"{'id': None, 'name': 'ETF Daily News'}",MarketBeat News,Ducommun Incorporated (NYSE:DCO) Receives $94.67 Average Price Target from Brokerages,"Ducommun Incorporated (NYSE:DCO – Get Free Report) has earned a consensus recommendation of “Buy” from the five ratings firms that are covering the stock, MarketBeat reports. Five research analysts have rated the stock with a buy recommendation. The average 1…",https://www.etfdailynews.com/2025/07/17/ducommun-incorporated-nysedco-receives-94-67-average-price-target-from-brokerages/,https://www.americanbankingnews.com/wp-content/timthumb/timthumb.php?src=https://www.marketbeat.com/logos/ducommun-incorporated-logo-1200x675.jpg?v=20221209103807&w=240&h=240&zc=2,2025-07-17T05:03:06Z,"Ducommun Incorporated (NYSE:DCO – Get Free Report) has earned a consensus recommendation of “Buy” from the five ratings firms that are covering the stock, MarketBeat reports. Five research analysts h… [+4561 chars]"
"{'id': None, 'name': 'ETF Daily News'}",MarketBeat News,Tidewater Inc. (NYSE:TDW) Receives $69.33 Average PT from Brokerages,"Shares of Tidewater Inc. (NYSE:TDW – Get Free Report) have earned an average rating of “Hold” from the five analysts that are presently covering the stock, Marketbeat reports. Three investment analysts have rated the stock with a hold recommendation and two h…",https://www.etfdailynews.com/2025/07/17/tidewater-inc-nysetdw-receives-69-33-average-pt-from-brokerages/,https://www.americanbankingnews.com/wp-content/timthumb/timthumb.php?src=https://www.marketbeat.com/logos/tidewater-inc-logo-1200x675.png?v=20221129151036&w=240&h=240&zc=2,2025-07-17T05:03:06Z,"Shares of Tidewater Inc. (NYSE:TDW – Get Free Report) have earned an average rating of “Hold” from the five analysts that are presently covering the stock, Marketbeat reports. Three investment analys… [+5065 chars]"
"{'id': None, 'name': 'ETF Daily News'}",MarketBeat News,Aviva PLC (OTCMKTS:AVVIY) Given Average Rating of “Buy” by Analysts,"Aviva PLC (OTCMKTS:AVVIY – Get Free Report) has received an average rating of “Buy” from the four research firms that are presently covering the firm, Marketbeat reports. Two research analysts have rated the stock with a hold recommendation and two have issue…",https://www.etfdailynews.com/2025/07/17/aviva-plc-otcmktsavviy-given-average-rating-of-buy-by-analysts/,https://www.americanbankingnews.com/wp-content/timthumb/timthumb.php?src=https://www.marketbeat.com/logos/aviva-plc-logo-1200x675.png&w=240&h=240&zc=2,2025-07-17T05:03:06Z,"Aviva PLC (OTCMKTS:AVVIY – Get Free Report) has received an average rating of “Buy” from the four research firms that are presently covering the firm, Marketbeat reports. Two research analysts have r… [+1259 chars]"
"{'id': None, 'name': 'ETF Daily News'}",MarketBeat News,Brokerages Set EchoStar Corporation (NASDAQ:SATS) PT at $24.70,"EchoStar Corporation (NASDAQ:SATS – Get Free Report) has earned a consensus recommendation of “Hold” from the six brokerages that are currently covering the stock, Marketbeat reports. One investment analyst has rated the stock with a sell rating, four have is…",https://www.etfdailynews.com/2025/07/17/brokerages-set-echostar-corporation-nasdaqsats-pt-at-24-70/,https://www.americanbankingnews.com/wp-content/timthumb/timthumb.php?src=https://www.marketbeat.com/logos/echostar-co-logo-1200x675.jpg&w=240&h=240&zc=2,2025-07-17T05:03:06Z,"EchoStar Corporation (NASDAQ:SATS – Get Free Report) has earned a consensus recommendation of “Hold” from the six brokerages that are currently covering the stock, Marketbeat reports. One investment … [+3935 chars]"
"{'id': None, 'name': 'ETF Daily News'}",MarketBeat News,"LGI Homes, Inc. (NASDAQ:LGIH) Receives $93.33 Average Price Target from Brokerages","LGI Homes, Inc. (NASDAQ:LGIH – Get Free Report) has earned an average rating of “Hold” from the four ratings firms that are currently covering the firm, MarketBeat Ratings reports. One analyst has rated the stock with a sell rating, two have issued a hold rat…",https://www.etfdailynews.com/2025/07/17/lgi-homes-inc-nasdaqlgih-receives-93-33-average-price-target-from-brokerages/,https://www.americanbankingnews.com/wp-content/timthumb/timthumb.php?src=https://www.marketbeat.com/logos/lgi-homes-inc-logo-1200x675.jpg&w=240&h=240&zc=2,2025-07-17T05:03:05Z,"LGI Homes, Inc. (NASDAQ:LGIH – Get Free Report) has earned an average rating of “Hold” from the four ratings firms that are currently covering the firm, MarketBeat Ratings reports. One analyst has ra… [+4263 chars]"
"{'id': None, 'name': 'ETF Daily News'}",MarketBeat News,BE Semiconductor Industries NV (OTCMKTS:BESIY) Receives Average Rating of “Moderate Buy” from Analysts,"Shares of BE Semiconductor Industries NV (OTCMKTS:BESIY – Get Free Report) have received a consensus recommendation of “Moderate Buy” from the seven analysts that are covering the stock, Marketbeat reports. Four investment analysts have rated the stock with a…",https://www.etfdailynews.com/2025/07/17/be-semiconductor-industries-nv-otcmktsbesiy-receives-average-rating-of-moderate-buy-from-analysts/,https://www.americanbankingnews.com/wp-content/timthumb/timthumb.php?src=https://www.marketbeat.com/logos/besi-logo-1200x675.jpg&w=240&h=240&zc=2,2025-07-17T05:03:05Z,"Shares of BE Semiconductor Industries NV (OTCMKTS:BESIY – Get Free Report) have received a consensus recommendation of “Moderate Buy” from the seven analysts that are covering the stock, Marketbeat r… [+2679 chars]"
"{'id': None, 'name': 'ETF Daily News'}",MarketBeat News,Teck Resources Ltd. (TSE:TCK) Receives Average Recommendation of “Moderate Buy” from Brokerages,"Teck Resources Ltd. (TSE:TCK – Get Free Report) has received an average recommendation of “Moderate Buy” from the six analysts that are presently covering the firm, Marketbeat Ratings reports. Four equities research analysts have rated the stock with a hold r…",https://www.etfdailynews.com/2025/07/17/teck-resources-ltd-tsetck-receives-average-recommendation-of-moderate-buy-from-brokerages/,https://www.americanbankingnews.com/wp-content/timthumb/timthumb.php?src=https://www.marketbeat.com/logos/teck-resources-ltd-logo-1200x675.png?v=20211208073058&w=240&h=240&zc=2,2025-07-17T05:03:04Z,"Teck Resources Ltd. (TSE:TCK – Get Free Report) has received an average recommendation of “Moderate Buy” from the six analysts that are presently covering the firm, Marketbeat Ratings reports. Four e… [+1062 chars]"
"{'id': None, 'name': 'ETF Daily News'}",MarketBeat News,"Brokerages Set Akebia Therapeutics, Inc. (NASDAQ:AKBA) Price Target at $6.75","Akebia Therapeutics, Inc. (NASDAQ:AKBA – Get Free Report) has been assigned an average recommendation of “Buy” from the five brokerages that are currently covering the company, MarketBeat Ratings reports. Four research analysts have rated the stock with a buy…",https://www.etfdailynews.com/2025/07/17/brokerages-set-akebia-therapeutics-inc-nasdaqakba-price-target-at-6-75/,https://www.americanbankingnews.com/wp-content/timthumb/timthumb.php?src=https://www.marketbeat.com/logos/akebia-therapeutics-inc-logo-1200x675.png?v=20221223110418&w=240&h=240&zc=2,2025-07-17T05:03:04Z,"Akebia Therapeutics, Inc. (NASDAQ:AKBA – Get Free Report) has been assigned an average recommendation of “Buy” from the five brokerages that are currently covering the company, MarketBeat Ratings rep… [+5254 chars]"
"{'id': None, 'name': 'ETF Daily News'}",MarketBeat News,Melco Resorts & Entertainment Limited (NASDAQ:MLCO) Receives $7.90 Consensus Target Price from Analysts,"Shares of Melco Resorts & Entertainment Limited (NASDAQ:MLCO – Get Free Report) have been assigned a consensus rating of “Moderate Buy” from the six ratings firms that are covering the stock, MarketBeat Ratings reports. One research analyst has rated the stoc…",https://www.etfdailynews.com/2025/07/17/melco-resorts-entertainment-limited-nasdaqmlco-receives-7-90-consensus-target-price-from-analysts/,https://www.americanbankingnews.com/wp-content/timthumb/timthumb.php?src=https://www.marketbeat.com/logos/melco-resorts--entertainment-limited-logo-1200x675.jpg?v=20221118141226&w=240&h=240&zc=2,2025-07-17T05:03:04Z,"Shares of Melco Resorts &amp; Entertainment Limited (NASDAQ:MLCO – Get Free Report) have been assigned a consensus rating of “Moderate Buy” from the six ratings firms that are covering the stock, Mar… [+4656 chars]"
"{'id': None, 'name': 'ETF Daily News'}",MarketBeat News,"Franklin BSP Realty Trust, Inc. (NYSE:FBRT) Receives $15.30 Average Target Price from Analysts","Franklin BSP Realty Trust, Inc. (NYSE:FBRT – Get Free Report) has earned a consensus rating of “Buy” from the seven research firms that are currently covering the firm, Marketbeat.com reports. Five analysts have rated the stock with a buy recommendation and t…",https://www.etfdailynews.com/2025/07/17/franklin-bsp-realty-trust-inc-nysefbrt-receives-15-30-average-target-price-from-analysts/,https://www.americanbankingnews.com/wp-content/timthumb/timthumb.php?src=https://www.marketbeat.com/logos/franklin-bsp-realty-trust-inc-logo-1200x675.png?v=20211207110542&w=240&h=240&zc=2,2025-07-17T05:03:03Z,"Franklin BSP Realty Trust, Inc. (NYSE:FBRT – Get Free Report) has earned a consensus rating of “Buy” from the seven research firms that are currently covering the firm, Marketbeat.com reports. Five a… [+4225 chars]"
"{'id': None, 'name': 'ETF Daily News'}",MarketBeat News,Comparing TIX (OTCMKTS:TIXC) & Target Hospitality (NASDAQ:TH),"TIX (OTCMKTS:TIXC – Get Free Report) and Target Hospitality (NASDAQ:TH – Get Free Report) are both consumer discretionary companies, but which is the better stock? We will compare the two businesses based on the strength of their institutional ownership, risk…",https://www.etfdailynews.com/2025/07/17/comparing-tix-otcmktstixc-target-hospitality-nasdaqth/,https://www.americanbankingnews.com/wp-content/timthumb/timthumb.php?src=https://www.marketbeat.com/logos/target-hospitality-corp-logo-1200x675.png?v=20221129190154&w=240&h=240&zc=2,2025-07-17T05:03:02Z,"TIX (OTCMKTS:TIXC – Get Free Report) and Target Hospitality (NASDAQ:TH – Get Free Report) are both consumer discretionary companies, but which is the better stock? We will compare the two businesses … [+4704 chars]"
"{'id': None, 'name': 'ETF Daily News'}",MarketBeat News,Comparing Horiba (OTCMKTS:HRIBF) and Hillenbrand (NYSE:HI),"Hillenbrand (NYSE:HI – Get Free Report) and Horiba (OTCMKTS:HRIBF – Get Free Report) are both industrials companies, but which is the superior business? We will compare the two businesses based on the strength of their dividends, earnings, profitability, valu…",https://www.etfdailynews.com/2025/07/17/comparing-horiba-otcmktshribf-and-hillenbrand-nysehi/,https://www.americanbankingnews.com/wp-content/timthumb/timthumb.php?src=https://www.marketbeat.com/logos/horiba-ltd-logo-1200x675.jpg&w=240&h=240&zc=2,2025-07-17T05:03:01Z,"Hillenbrand (NYSE:HI – Get Free Report) and Horiba (OTCMKTS:HRIBF – Get Free Report) are both industrials companies, but which is the superior business? We will compare the two businesses based on th… [+6092 chars]"
"{'id': None, 'name': 'ETF Daily News'}",MarketBeat News,Karman Holdings Inc. (NYSE:KRMN) Receives $49.25 Average Price Target from Analysts,"Karman Holdings Inc. (NYSE:KRMN – Get Free Report) has been assigned an average recommendation of “Buy” from the six ratings firms that are presently covering the firm, MarketBeat reports. Five analysts have rated the stock with a buy rating and one has issue…",https://www.etfdailynews.com/2025/07/17/karman-holdings-inc-nysekrmn-receives-49-25-average-price-target-from-analysts/,https://www.americanbankingnews.com/wp-content/timthumb/timthumb.php?src=https://www.marketbeat.com/logos/karman-holdings-inc-logo-1200x675.jpg?v=20250303125928&w=240&h=240&zc=2,2025-07-17T05:03:01Z,"Karman Holdings Inc. (NYSE:KRMN – Get Free Report) has been assigned an average recommendation of “Buy” from the six ratings firms that are presently covering the firm, MarketBeat reports. Five analy… [+2884 chars]"
"{'id': None, 'name': 'ETF Daily News'}",MarketBeat News,"Brokerages Set StandardAero, Inc. (NYSE:SARO) Target Price at $34.67","Shares of StandardAero, Inc. (NYSE:SARO – Get Free Report) have earned an average rating of “Moderate Buy” from the nine research firms that are currently covering the stock, Marketbeat Ratings reports. Three analysts have rated the stock with a hold rating, …",https://www.etfdailynews.com/2025/07/17/brokerages-set-standardaero-inc-nysesaro-target-price-at-34-67/,https://www.americanbankingnews.com/wp-content/timthumb/timthumb.php?src=https://www.marketbeat.com/logos/standardaero-inc-logo-1200x675.jpg?v=20241216115636&w=240&h=240&zc=2,2025-07-17T05:03:01Z,"Shares of StandardAero, Inc. (NYSE:SARO – Get Free Report) have earned an average rating of “Moderate Buy” from the nine research firms that are currently covering the stock, Marketbeat Ratings repor… [+4198 chars]"
"{'id': None, 'name': 'ETF Daily News'}",MarketBeat News,Brokerages Set Pilgrim’s Pride Corporation (NASDAQ:PPC) PT at $48.67,"Shares of Pilgrim’s Pride Corporation (NASDAQ:PPC – Get Free Report) have been given a consensus rating of “Hold” by the seven ratings firms that are presently covering the company, MarketBeat.com reports. Six investment analysts have rated the stock with a h…",https://www.etfdailynews.com/2025/07/17/brokerages-set-pilgrims-pride-corporation-nasdaqppc-pt-at-48-67/,https://www.americanbankingnews.com/wp-content/timthumb/timthumb.php?src=https://www.marketbeat.com/logos/pilgrims-pride-co-logo-1200x675.png?v=20240521114606&w=240&h=240&zc=2,2025-07-17T05:03:01Z,"Shares of Pilgrim’s Pride Corporation (NASDAQ:PPC – Get Free Report) have been given a consensus rating of “Hold” by the seven ratings firms that are presently covering the company, MarketBeat.com re… [+3943 chars]"
"{'id': None, 'name': 'ETF Daily News'}",MarketBeat News,Nidec (NJDCY) & Its Rivals Head-To-Head Comparison,"Earnings & Valuation This table compares Nidec and its peers top-line revenue, earnings per share and valuation. Gross Revenue Net Income Price/Earnings Ratio Nidec $17.12 billion $1.11 billion 19.17 Nidec Competitors $2.48 billion $167.53 million 35.12 Nidec…",https://www.etfdailynews.com/2025/07/17/nidec-njdcy-its-rivals-head-to-head-comparison/,https://www.americanbankingnews.com/wp-content/timthumb/timthumb.php?src=https://www.marketbeat.com/logos/nidec-co-logo-1200x675.gif&w=240&h=240&zc=2,2025-07-17T05:03:01Z,"Earnings &amp; Valuation
This table compares Nidec and its peers top-line revenue, earnings per share and valuation.
<table><tr><td></td><td>Gross Revenue</td><td>Net Income</td><td>Price/Earnings … [+3089 chars]"
"{'id': None, 'name': 'ETF Daily News'}",MarketBeat News,Critical Review: Verve Therapeutics (NASDAQ:VERV) & Elite Pharmaceuticals (OTCMKTS:ELTP),"Verve Therapeutics (NASDAQ:VERV – Get Free Report) and Elite Pharmaceuticals (OTCMKTS:ELTP – Get Free Report) are both small-cap medical companies, but which is the better stock? We will compare the two businesses based on the strength of their profitability,…",https://www.etfdailynews.com/2025/07/17/critical-review-verve-therapeutics-nasdaqverv-elite-pharmaceuticals-otcmktseltp/,https://www.americanbankingnews.com/wp-content/timthumb/timthumb.php?src=https://www.marketbeat.com/logos/elite-pharmaceuticals-inc-logo-1200x675.png?v=20241108125419&w=240&h=240&zc=2,2025-07-17T05:03:01Z,"Verve Therapeutics (NASDAQ:VERV – Get Free Report) and Elite Pharmaceuticals (OTCMKTS:ELTP – Get Free Report) are both small-cap medical companies, but which is the better stock? We will compare the … [+6169 chars]"
"{'id': None, 'name': 'ETF Daily News'}",MarketBeat News,Comparing Escalon Medical (OTCMKTS:ESMC) & Lifevantage (NASDAQ:LFVN),"Escalon Medical (OTCMKTS:ESMC – Get Free Report) and Lifevantage (NASDAQ:LFVN – Get Free Report) are both small-cap medical companies, but which is the better stock? We will compare the two businesses based on the strength of their analyst recommendations, pr…",https://www.etfdailynews.com/2025/07/17/comparing-escalon-medical-otcmktsesmc-lifevantage-nasdaqlfvn/,https://www.americanbankingnews.com/wp-content/timthumb/timthumb.php?src=https://www.marketbeat.com/logos/lifevantage-co-logo-1200x675.jpg?v=20230106141556&w=240&h=240&zc=2,2025-07-17T05:03:00Z,"Escalon Medical (OTCMKTS:ESMC – Get Free Report) and Lifevantage (NASDAQ:LFVN – Get Free Report) are both small-cap medical companies, but which is the better stock? We will compare the two businesse… [+6204 chars]"
"{'id': None, 'name': 'ETF Daily News'}",MarketBeat News,Comparing Big Rock Brewery (BRBMF) & Its Peers,"Volatility & Risk Big Rock Brewery has a beta of -0.63, suggesting that its stock price is 163% less volatile than the S&P 500. Comparatively, Big Rock Brewery’s rivals have a beta of 1.58, suggesting that their average stock price is 58% more volatile than t…",https://www.etfdailynews.com/2025/07/17/comparing-big-rock-brewery-brbmf-its-peers/,https://www.americanbankingnews.com/wp-content/timthumb/timthumb.php?src=https://www.marketbeat.com/logos/big-rock-brewery-inc-logo-1200x675.png&w=240&h=240&zc=2,2025-07-17T05:02:57Z,"Volatility &amp; Risk
Big Rock Brewery has a beta of -0.63, suggesting that its stock price is 163% less volatile than the S&amp;P 500. Comparatively, Big Rock Brewery’s rivals have a beta of 1.58, … [+2888 chars]"
"{'id': None, 'name': 'ETF Daily News'}",MarketBeat News,Comparing Agrify (NASDAQ:AGFY) & CPI Card Group (NASDAQ:PMTS),"CPI Card Group (NASDAQ:PMTS – Get Free Report) and Agrify (NASDAQ:AGFY – Get Free Report) are both small-cap business services companies, but which is the superior stock? We will contrast the two companies based on the strength of their valuation, earnings, a…",https://www.etfdailynews.com/2025/07/17/comparing-agrify-nasdaqagfy-cpi-card-group-nasdaqpmts/,https://www.americanbankingnews.com/wp-content/timthumb/timthumb.php?src=https://www.marketbeat.com/logos/agrify-co-logo-1200x675.png?v=20210428062103&w=240&h=240&zc=2,2025-07-17T05:02:57Z,"CPI Card Group (NASDAQ:PMTS – Get Free Report) and Agrify (NASDAQ:AGFY – Get Free Report) are both small-cap business services companies, but which is the superior stock? We will contrast the two com… [+5464 chars]"
"{'id': 'the-times-of-india', 'name': 'The Times of India'}",ETMarkets.com,Stock market update: Nifty Auto index advances 0.3% in a weak market,The Nifty Auto index was trading 0.3 per cent  up  at 24083.5.,https://economictimes.indiatimes.com/markets/stocks/stock-watch/stock-market-update-nifty-auto-index-advances-0-3-in-a-weak-market/articleshow/122614887.cms,"https://img.etimg.com/thumb/msid-83608600,width-1200,height-630,imgsize-23742,overlay-etmarkets/articleshow.jpg",2025-07-17T05:00:25Z,"NEW DELHI: The Nifty Auto index traded positive around 10:30AM(IST)on Thursday in a weak market. Balkrishna Industries Ltd.(up 3.1 per cent), Tube Investments of India Ltd.(up 0.91 per cent), Tata Mo… [+1165 chars]"
"{'id': None, 'name': 'Hackaday'}",Bryan Cockfield,Vintage Hardware Find Includes Time Capsule of Data,"Before social media brought the Internet to the masses, and before even Napster, ICQ, and AIM gave those with a phone line a reason to connect online at all, those who went online often went to a B…",https://hackaday.com/2025/07/16/vintage-hardware-find-includes-time-capsule-of-data/,https://hackaday.com/wp-content/uploads/2025/07/italian-bbs-main.png,2025-07-17T05:00:24Z,"Before social media brought the Internet to the masses, and before even Napster, ICQ, and AIM gave those with a phone line a reason to connect online at all, those who went online often went to a BBS… [+1312 chars]"
"{'id': 'the-irish-times', 'name': 'The Irish Times'}",Finn McRedmond,Finn McRedmond: Ireland is learning what Britain has already discovered - the status quo doesn’t always endure,"Just like Britain was left staring into the abyss after Brexit, Ireland is wondering why we ever left the economy so vulnerable to the whims of an irrational actor like Trump",https://www.irishtimes.com/opinion/2025/07/17/ireland-is-learning-what-britain-has-already-discovered-the-status-quo-doesnt-always-endure/,https://www.irishtimes.com/resizer/v2/5SRZ6VMF2NDI5LPZNV2TXNWHYY.jpg?smart=true&auth=fa6057b7e1deb7832c621df24656ecb85e91259e9f18e867198af116f0e6638b&width=1200&height=630,2025-07-17T05:00:01Z,"Last weekend, I did my best impression of a Shire Tory. I was at Henley Regatta, the worlds most prestigious rowing competition (spectating, not participating). The town Henley-on-Thames is a bit lik… [+4622 chars]"
"{'id': 'the-irish-times', 'name': 'The Irish Times'}",Neil McDonnell,Opinion: The law is deeply flawed when a retailer who asks a customer for ID can be sued for defamation,"On legal advice, many retailers now operate a “no challenge” policy towards suspected shoplifters. This has to change",https://www.irishtimes.com/opinion/2025/07/17/opinion-the-law-is-deeply-flawed-when-a-retailer-who-asks-a-customer-for-id-can-be-sued-for-defamation/,https://www.irishtimes.com/resizer/v2/5XYAUA7XAPJ2ZSG3JQFTMDQAYE.jpg?smart=true&auth=d1ece5fba4a72af1ab6079e4a50f3319ba3ae1f6ba53802d727367526dc63b70&width=1200&height=630,2025-07-17T05:00:01Z,"The Defamation (Amendment) Bill 2024 reaches Seanad third stage on Thursday at 11.45am. High Noon.
So far, this deeply flawed Bill has sailed through the Dáil and Seanad, unperturbed by anything oth… [+5644 chars]"
"{'id': 'the-irish-times', 'name': 'The Irish Times'}",Newton Emerson,Newton Emerson: A tricky question on breakfast TV for Mary Lou McDonald,The message to the British public is 'let us take his expensive burden off your hands' while to the Republic it’s that reunification will be almost painless,https://www.irishtimes.com/opinion/2025/07/17/newton-emerson-a-tricky-question-on-breakfast-tv-for-mary-lou-mcdonald/,https://www.irishtimes.com/resizer/v2/QQMCUWHEENJ3LCYF2ULC7QKROA.jpg?smart=true&auth=0e27823c3465273844571c6c04b4c1e29aaa56a1e59c1d15b827530a22e42164&width=1200&height=630,2025-07-17T05:00:01Z,"Does the island of Ireland contain two badly-run economies or one, or none? The question arises following Mary Lou McDonalds appearance on Mondays Good Morning Britain on ITV.
After calling for a un… [+4953 chars]"
"{'id': 'the-irish-times', 'name': 'The Irish Times'}",Richard Cantillon,"Trump pulls back on firing Powell, again",US president still appears likely to try to oust Fed chairman eventually,https://www.irishtimes.com/business/2025/07/17/trump-pulls-back-on-firing-powell-again/,https://www.irishtimes.com/resizer/v2/PTMZ5WU2PBLD7TBCH6OXE2KTDI.jpg?smart=true&auth=7160a8677d746374a2fb7c57d29d1f51613a9be579c15f91ff9ac9d9d0d60ec7&width=1200&height=630,2025-07-17T05:00:01Z,"If it didnt seem inevitable before Wednesday, it does now.
US president Donald Trump has insulted and pushed Federal Reserve president Jerome Powell almost since the day he returned to office, deman… [+1931 chars]"
"{'id': 'the-irish-times', 'name': 'The Irish Times'}",Joe Brennan,"Bank of Ireland raises Irish economic growth estimates, with one big caveat",Forecasts assume pharmaceuticals would be exempt from threatened US tariffs,https://www.irishtimes.com/business/2025/07/17/bank-of-ireland-raises-irish-economic-growth-estimates-with-one-big-caveat/,https://www.irishtimes.com/resizer/v2/YX4UTGKPZ64WHOFCIYRXGOO7LM.jpg?smart=true&auth=530fdb51e1ea5e4cd3d94106f6f740b273983f49352b11771ff42158b3c7b172&width=1200&height=630,2025-07-17T05:00:01Z,"Bank of Ireland has raised its Irish economic growth estimates, amid surging exports and investment spending. 
However, it has applied a major caveat: that US president Donald Trump will abandon his… [+2651 chars]"
"{'id': None, 'name': 'Hhhistory.com'}",Jubileewriter,The Evolution and Struggles of Farmers Markets in America,"Today I thought it would be fun to explore the origin of farmers markets in America. Grant it, farmers and artisans selling their wa...",https://www.hhhistory.com/2025/07/the-evolution-and-struggles-of-farmers.html,https://blogger.googleusercontent.com/img/b/R29vZ2xl/AVvXsEgctLvAK5rwHzwmRvUNuJzJhQp6FysQDUdlLw7VzXSRSgHVvB-s_Cepx-WaShHCMC_tmXUCh4dchyphenhyphenYx1Qv6wD1vLQM7zFby78wROMW9e5gYqK5UTCSrfrGHvyO7kHX9crLuJhHWdo6aNdgfBR0D4YzoEL7P-YSQh3r2VKW3lPT4ZHtUNGd8JNrQL4LeDmE/w1200-h630-p-k-no-nu/Cindy%20blog%20banner(5).png,2025-07-17T05:00:00Z,"Today
I thought it would be fun to explore the origin of farmers markets in America.
Grant it, farmers and artisans selling their wares in open markets goes back to
ancient times globally. For this b… [+5933 chars]"
"{'id': None, 'name': 'GlobeNewswire'}",Verkkokauppa.com Oyj,Verkkokauppa.com Oyj: Strong performance in a cautiously recovering market,HALF-YEAR REPORT for 1 January – 30 June 2025  Verkkokauppa.com Oyj: Strong performance in a cautiously recovering market  Verkkokauppa.com......,https://www.globenewswire.com/news-release/2025/07/17/3116950/0/en/Verkkokauppa-com-Oyj-Strong-performance-in-a-cautiously-recovering-market.html,https://ml-eu.globenewswire.com/Resource/Download/1add0bfe-8c33-4f5b-9225-66e63b2643af,2025-07-17T05:00:00Z,"HALF-YEARREPORTfor 1January30June 2025
Verkkokauppa.comOyj:Strongperformanceinacautiouslyrecoveringmarket
Verkkokauppa.com Oyj        HALF-YEAR REPORT 17 July 2025, 8:00 a.m. EET
Unless otherwise … [+33045 chars]"
