source,author,title,description,url,urlToImage,publishedAt,content
"{'id': None, 'name': 'Biztoc.com'}",breakingthenews.net,Asia-Pacific mostly higher after data,"Major stock markets across the Asia-Pacific region traded mostly with gains during the afternoon session on Thursday following the release of economic data from Japan and Australia.At the same time, m...",https://biztoc.com/x/23ad8139c14db7ca,https://biztoc.com/cdn/23ad8139c14db7ca_s.webp,2025-07-17T05:30:38Z,"Major stock markets across the Asia-Pacific region traded mostly with gains during the afternoon session on Thursday following the release of economic data from Japan and Australia.At the same time, … [+69 chars]"
"{'id': None, 'name': 'Biztoc.com'}",bloomberg.com,Ultra-Rare Metal Rides AI Boom as Commodities Star Performer,,https://biztoc.com/x/59f50693f0aa074d,https://biztoc.com/cdn/59f50693f0aa074d_s.webp,2025-07-17T05:30:31Z,"{ window.open(this.href, '_blank'); }, 200); return false;""&gt;Why are Meta shareholders suing Mark Zuckerberg? { window.open(this.href, '_blank'); }, 200); return false;""&gt;How will JPMorgan's new … [+783 chars]"
"{'id': 'the-times-of-india', 'name': 'The Times of India'}",ET Online,"Samsung Galaxy S26 Ultra: Expected launch date, price in India, design, camera upgrades, specs & leaks; everything you need to know","Samsung Galaxy S26 Ultra is creating buzz. Leaks suggest a January 2026 launch in India. The price could start at ₹1,59,990. Design enhancements include a cleaner rear panel and increased screen-to-body ratio. A 200MP Sony camera might replace the ISOCELL sen…",https://economictimes.indiatimes.com/news/new-updates/samsung-galaxy-s26-ultra-expected-launch-date-price-in-india-design-camera-upgrades-specs-leaks-everything-you-need-to-know/articleshow/122616036.cms,"https://img.etimg.com/thumb/msid-122616154,width-1200,height-630,imgsize-8686,overlay-economictimes/articleshow.jpg",2025-07-17T05:30:26Z,"Investment Ideas
Grow your wealth with stock ideas &amp; sectoral trends.
Stock Reports Plus
Buy low &amp; sell high with access to Stock Score, Upside potential &amp; more. 
BigBull Porfolio
Ge… [+438 chars]"
"{'id': 'the-times-of-india', 'name': 'The Times of India'}",Riya Sharma,Waaree Renewable shares rally 30% in 3 days ahead of Q1 results,"Waaree Renewable's share price has rallied nearly 30% in three days ahead of its Q1FY26 results, surging past Rs 1,200 for the first time in months. The surge is supported by improving sentiment in the renewable energy sector ahead of the company's Q1 earning…",https://economictimes.indiatimes.com/markets/stocks/news/waaree-renewable-shares-rally-30-in-3-days-ahead-of-q1-results/articleshow/122616122.cms,"https://img.etimg.com/thumb/msid-122616086,width-1200,height-630,imgsize-93168,overlay-etmarkets/articleshow.jpg",2025-07-17T05:29:11Z,"Shares of Waaree Renewable Technologies surged as much as 5.2% on Thursday to Rs 1,265.80, extending their three-day rally to 29.8%, as positioned ahead of the companys June-quarter results scheduled… [+2098 chars]"
"{'id': 'the-times-of-india', 'name': 'The Times of India'}",ETMarkets.com,Share market update: Most active stocks on D-Street today in terms of volume,The NSE Nifty index was trading 49.46 points  down  at 25162.6,https://economictimes.indiatimes.com/markets/stocks/stock-watch/share-market-update-most-active-stocks-on-d-street-today-in-terms-of-volume/articleshow/122616053.cms,"https://img.etimg.com/thumb/msid-83209716,width-1200,height-630,imgsize-107089,overlay-etmarkets/articleshow.jpg",2025-07-17T05:27:41Z,"(What's moving Sensex and Nifty Track latest market news, stock tips, Budget 2025, Share Market on Budget 2025 and expert advice, on ETMarkets. Also, ETMarkets.com is now on Telegram. For fastest new… [+330 chars]"
"{'id': None, 'name': 'Pypi.org'}",support@skydeck.ai,mseep-hkopenai.hk-finance-mcp-server added to PyPI,Hong Kong Finance MCP Server providing financial data tools,https://pypi.org/project/mseep-hkopenai-hk-finance-mcp-server/,,2025-07-17T05:27:30Z,"A required part of this site couldnt load. This may be due to a browser
 extension, network issues, or browser settings. Please check your
 connection, disable any ad blockers, or try using a diffe… [+12 chars]"
"{'id': None, 'name': 'Pypi.org'}",support@skydeck.ai,mseep-hkopenai.hk-finance-mcp-server 0.1.7,Hong Kong Finance MCP Server providing financial data tools,https://pypi.org/project/mseep-hkopenai-hk-finance-mcp-server/0.1.7/,,2025-07-17T05:27:30Z,"A required part of this site couldnt load. This may be due to a browser
 extension, network issues, or browser settings. Please check your
 connection, disable any ad blockers, or try using a diffe… [+12 chars]"
"{'id': None, 'name': 'ETF Daily News'}",MarketBeat News,DENTSPLY SIRONA Q2 EPS Estimate Lifted by Leerink Partnrs,"DENTSPLY SIRONA Inc. (NASDAQ:XRAY – Free Report) – Leerink Partnrs upped their Q2 2025 earnings per share (EPS) estimates for shares of DENTSPLY SIRONA in a report released on Monday, July 14th. Leerink Partnrs analyst M. Cherny now anticipates that the medic…",https://www.etfdailynews.com/2025/07/17/dentsply-sirona-q2-eps-estimate-lifted-by-leerink-partnrs/,https://www.americanbankingnews.com/wp-content/timthumb/timthumb.php?src=https://www.marketbeat.com/logos/dentsply-sirona-inc-logo-1200x675.jpg?v=20221111142251&w=240&h=240&zc=2,2025-07-17T05:27:05Z,"DENTSPLY SIRONA Inc. (NASDAQ:XRAY – Free Report) – Leerink Partnrs upped their Q2 2025 earnings per share (EPS) estimates for shares of DENTSPLY SIRONA in a report released on Monday, July 14th. Leer… [+5451 chars]"
"{'id': 'the-times-of-india', 'name': 'The Times of India'}",ET Online,"What she ate, how she lived - How the Russian woman spent 8 years in a cave in a forest near a popular tourist place in Karnataka","In Karnataka's Uttara Kannada district, Nina Kutina, a Russian woman, and her two daughters were found living in a secluded cave. Kutina, drawn to Hindu beliefs, overstayed her visa after arriving in 2016. For two months, they resided in Ramatirtha hills, par…",https://economictimes.indiatimes.com/magazines/panache/what-she-ate-how-she-lived-how-the-russian-woman-spent-8-years-in-a-cave-in-a-forest-near-a-popular-tourist-place-in-karnataka/articleshow/122615557.cms,"https://img.etimg.com/thumb/msid-122615887,width-1200,height-630,imgsize-50394,overlay-etpanache/articleshow.jpg",2025-07-17T05:25:21Z,"In an astonishing revelation from the Ramatirtha forested region of Kumta taluk, in Karnatakas Uttara Kannada district, a 40-year-old Russian woman named Nina Kutinaalso known locally as Mohiwas disc… [+3539 chars]"
"{'id': None, 'name': 'ETF Daily News'}",MarketBeat News,Cake Box (LON:CBOX) Receives House Stock Rating from Shore Capital,"Cake Box (LON:CBOX – Get Free Report)‘s stock had its “house stock” rating reaffirmed by analysts at Shore Capital in a report released on Tuesday, MarketBeat reports. Cake Box Stock Down 4.2% CBOX opened at GBX 179.70 ($2.41) on Tuesday. The business has a 5…",https://www.etfdailynews.com/2025/07/17/cake-box-loncbox-receives-house-stock-rating-from-shore-capital/,https://www.americanbankingnews.com/wp-content/timthumb/timthumb.php?src=https://www.marketbeat.com/logos/cake-box-holdings-plc-logo-1200x675.png?v=20240611124848&w=240&h=240&zc=2,2025-07-17T05:23:08Z,"Cake Box (LON:CBOX – Get Free Report)‘s stock had its “house stock” rating reaffirmed by analysts at Shore Capital in a report released on Tuesday, MarketBeat reports.
Cake Box Stock Down 4.2%
CBOX… [+1498 chars]"
"{'id': 'the-times-of-india', 'name': 'The Times of India'}",ETMarkets.com,Stock market update: Nifty Realty index advances 1.17% in a weak market,The Nifty Realty index was trading 1.17 per cent  up  at 1000.45.,https://economictimes.indiatimes.com/markets/stocks/stock-watch/stock-market-update-nifty-realty-index-advances-1-17-in-a-weak-market/articleshow/122615843.cms,"https://img.etimg.com/thumb/msid-81699096,width-1200,height-630,imgsize-194573,overlay-etmarkets/articleshow.jpg",2025-07-17T05:22:33Z,"NEW DELHI: The Nifty Realty index traded positive around 10:52AM(IST)on Thursday in a weak market. Prestige Estates Projects Ltd.(up 3.34 per cent), Sobha Ltd.(up 2.08 per cent), Godrej Properties Lt… [+995 chars]"
"{'id': None, 'name': 'Naftemporiki.gr'}",Γιάννα Βαρδαλαχάκη,METLEN honors its people in the new campaign “We are METLEN”,"METLEN, a global company with a Greek heart, is launching its new campaign titled “We are METLEN.”
With operations in over 40 countries, a workforce of more than 9,000 employees,…
METLEN honors its people in the new campaign “We are METLEN” - Η ΝΑΥΤΕΜΠΟΡΙΚΗ",https://www.naftemporiki.gr/english/1982509/metlen-honors-its-people-in-the-new-campaign-we-are-metlen/,https://www.naftemporiki.gr/wp-content/uploads/2025/07/WeareMETLEN_2.jpg,2025-07-17T05:21:24Z,"METLEN, a global company with a Greek heart, is launching its new campaign titled “We are METLEN.”
With operations in over 40 countries, a workforce of more than 9,000 employees, and nearly 300 proj… [+680 chars]"
"{'id': None, 'name': 'The Conversation Africa'}","Aidy Halimanjaya, Associate lecturer, Universitas Katolik Parahyangan",From coal to crops: Dayak women lead a just transition through backyard farming,Indigenous Dayak women are starting to cultivate chili peppers and lead a just energy transition through backyard farming,https://theconversation.com/from-coal-to-crops-dayak-women-lead-a-just-transition-through-backyard-farming-260827,https://images.theconversation.com/files/679050/original/file-20250614-56-pjikor.jpeg?ixlib=rb-4.1.0&rect=19%2C647%2C4077%2C2038&q=45&auto=format&w=1356&h=668&fit=crop,2025-07-17T05:21:22Z,"The global shift toward renewable energy is no longer a choice but a necessity: the climate crisis intensifies, with 2024 confirmed as the warmest year on record.
Yet in Indonesia, coal remains an e… [+5847 chars]"
"{'id': None, 'name': 'ETF Daily News'}",MarketBeat News,Investors Buy Large Volume of Direxion Daily Semiconductors Bear 3x Shares Call Options (NYSEARCA:SOXS),"Direxion Daily Semiconductors Bear 3x Shares (NYSEARCA:SOXS – Get Free Report) was the target of unusually large options trading activity on Wednesday. Investors acquired 62,387 call options on the stock. This represents an increase of approximately 34% compa…",https://www.etfdailynews.com/2025/07/17/investors-buy-large-volume-of-direxion-daily-semiconductors-bear-3x-shares-call-options-nysearcasoxs/,https://www.americanbankingnews.com/wp-content/timthumb/timthumb.php?src=https://www.marketbeat.com/logos/direxion-daily-semiconductors-bear-3x-shares-logo-1200x675.png?v=20220913114702&w=240&h=240&zc=2,2025-07-17T05:21:05Z,"Direxion Daily Semiconductors Bear 3x Shares (NYSEARCA:SOXS – Get Free Report) was the target of unusually large options trading activity on Wednesday. Investors acquired 62,387 call options on the s… [+2185 chars]"
"{'id': None, 'name': 'ETF Daily News'}",MarketBeat News,American Superconductor (NASDAQ:AMSC) Upgraded to “Buy” at Wall Street Zen,American Superconductor (NASDAQ:AMSC – Get Free Report) was upgraded by Wall Street Zen from a “hold” rating to a “buy” rating in a research report issued to clients and investors on Tuesday. American Superconductor Price Performance Shares of AMSC opened at …,https://www.etfdailynews.com/2025/07/17/american-superconductor-nasdaqamsc-upgraded-to-buy-at-wall-street-zen-2/,https://www.americanbankingnews.com/wp-content/timthumb/timthumb.php?src=https://www.marketbeat.com/logos/american-superconductor-co-logo-1200x675.png?v=20240524064434&w=240&h=240&zc=2,2025-07-17T05:21:05Z,"American Superconductor (NASDAQ:AMSC – Get Free Report) was upgraded by Wall Street Zen from a “hold” rating to a “buy” rating in a research report issued to clients and investors on Tuesday.
Americ… [+4369 chars]"
"{'id': None, 'name': 'ETF Daily News'}",MarketBeat News,JPMorgan Chase & Co. Has Lowered Expectations for Oxford Biomedica (LON:OXB) Stock Price,"Oxford Biomedica (LON:OXB – Get Free Report) had its target price reduced by research analysts at JPMorgan Chase & Co. from GBX 490 ($6.58) to GBX 400 ($5.37) in a note issued to investors on Tuesday, MarketBeat reports. The firm currently has a “neutral” rat…",https://www.etfdailynews.com/2025/07/17/jpmorgan-chase-co-has-lowered-expectations-for-oxford-biomedica-lonoxb-stock-price/,https://www.americanbankingnews.com/wp-content/timthumb/timthumb.php?src=https://www.marketbeat.com/logos/oxford-biomedica-plc-logo-1200x675.png?v=20240606110116&w=240&h=240&zc=2,2025-07-17T05:20:59Z,Oxford Biomedica (LON:OXB – Get Free Report) had its target price reduced by research analysts at JPMorgan Chase &amp; Co. from GBX 490 ($6.58) to GBX 400 ($5.37) in a note issued to investors on Tue… [+1800 chars]
"{'id': None, 'name': 'ETF Daily News'}",MarketBeat News,"Fresnillo (LON:FRES) Given New GBX 1,850 Price Target at JPMorgan Chase & Co.","Fresnillo (LON:FRES – Get Free Report) had its price target lifted by investment analysts at JPMorgan Chase & Co. from GBX 1,450 ($19.46) to GBX 1,850 ($24.83) in a note issued to investors on Tuesday, Marketbeat reports. The brokerage presently has an “overw…",https://www.etfdailynews.com/2025/07/17/fresnillo-lonfres-given-new-gbx-1850-price-target-at-jpmorgan-chase-co/,https://www.americanbankingnews.com/wp-content/timthumb/timthumb.php?src=https://www.marketbeat.com/logos/fresnillo-logo-1200x675.jpg&w=240&h=240&zc=2,2025-07-17T05:20:53Z,"Fresnillo (LON:FRES – Get Free Report) had its price target lifted by investment analysts at JPMorgan Chase &amp; Co. from GBX 1,450 ($19.46) to GBX 1,850 ($24.83) in a note issued to investors on Tu… [+2484 chars]"
"{'id': None, 'name': 'Biztoc.com'}",reuters.com,"Swatch half-year sales miss estimates, dragged by low demand in China",,https://biztoc.com/x/a3277cae2ad9f66e,https://biztoc.com/cdn/a3277cae2ad9f66e_s.webp,2025-07-17T05:20:04Z,"{ window.open(this.href, '_blank'); }, 200); return false;""&gt;Why are Meta shareholders suing Mark Zuckerberg? { window.open(this.href, '_blank'); }, 200); return false;""&gt;How will JPMorgan's new … [+795 chars]"
"{'id': None, 'name': 'Biztoc.com'}",fortune.com,NTT DC REIT’s flat trading debut shows Singapore’s struggle to revive a ‘lackluster’ stock market,"NTT DC REIT’s IPO was supposed to be a shot in the arm for Singapore’s flagging equity market, decried by analysts as “lackluster” due to its lack of growth stocks and tiny number of listings. NTT’s IPO had everything: It was oversubscribed, boasted sovereign…",https://biztoc.com/x/d1b22a60a2dac710,https://biztoc.com/cdn/d1b22a60a2dac710_s.webp,2025-07-17T05:19:50Z,"NTT DC REITs IPO was supposed to be a shot in the arm for Singapores flagging equity market, decried by analysts as lackluster due to its lack of growth stocks and tiny number of listings. NTTs IPO h… [+133 chars]"
"{'id': None, 'name': 'Freerepublic.com'}",Scottsdale Mint,US Metal War: Silver Becomes Strategic as Premiums Explode,"A Sudden Dislocation in the Silver Market July opened with an alarm bell. The Exchange for Physical (EFP) premium for silver, which reflects the cost of converting COMEX futures into deliverable metal, surged from near-zero levels to between 60 and 80 cents p…",https://freerepublic.com/focus/f-news/4329120/posts,,2025-07-17T05:19:49Z,"Skip to comments.
US Metal War: Silver Becomes Strategic as Premiums ExplodeScottsdale Mint ^
 | 15 July 25
 | Vince Lanci
Posted on 07/16/2025 10:19:49 PM PDT by delta7
A Sudden Dislocation in … [+5285 chars]"
"{'id': None, 'name': 'Biztoc.com'}",reuters.com,"Novartis slightly raises 2025 earnings forecast, citing strong Q2",,https://biztoc.com/x/f3597a33a42c4014,https://biztoc.com/cdn/f3597a33a42c4014_s.webp,2025-07-17T05:19:30Z,"{ window.open(this.href, '_blank'); }, 200); return false;""&gt;Why are Meta shareholders suing Mark Zuckerberg? { window.open(this.href, '_blank'); }, 200); return false;""&gt;How will JPMorgan's new … [+805 chars]"
"{'id': None, 'name': 'Economictimes.com'}",Reuters,Dollar’s slide set to boost U.S. multinationals' earnings,"Recent months have seen the U.S. Dollar Index fall nearly 10%—with half that drop occurring since early April. This sharp decline is expected to benefit American multinational companies, which previously suffered from a strong dollar that reduced the value of…",https://m.economictimes.com/markets/stocks/news/dollars-slide-set-to-boost-u-s-multinationals-earnings/dollars-decline-set-to-boost-u-s-multinationals/slideshow/122616030.cms,"https://img.etimg.com/thumb/msid-122616030,width-1070,height-580,overlay-etmarkets/slideshow.jpg",2025-07-17T05:19:29Z,"Jul 17, 2025, 10:56:49 AM IST
Recent months have seen the U.S. Dollar Index fall nearly 10%—with half that drop occurring since early April. This sharp decline is expected to benefit American multin… [+1523 chars]"
"{'id': None, 'name': 'Biztoc.com'}",barrons.com,Netflix Looks to Keep Up Its Hot Streak in the Second Quarter,,https://biztoc.com/x/4b6c7910b45cfa5b,https://biztoc.com/cdn/4b6c7910b45cfa5b_s.webp,2025-07-17T05:19:29Z,"{ window.open(this.href, '_blank'); }, 200); return false;""&gt;Why are Meta shareholders suing Mark Zuckerberg? { window.open(this.href, '_blank'); }, 200); return false;""&gt;How will JPMorgan's new … [+727 chars]"
"{'id': None, 'name': 'Biztoc.com'}",investing.com,European real estate stuck in 'zombieland' as recovery proves elusive,,https://biztoc.com/x/6e15e576f749d1ba,https://biztoc.com/cdn/6e15e576f749d1ba_s.webp,2025-07-17T05:19:24Z,"{ window.open(this.href, '_blank'); }, 200); return false;""&gt;Why are Meta shareholders suing Mark Zuckerberg? { window.open(this.href, '_blank'); }, 200); return false;""&gt;How will JPMorgan's new … [+784 chars]"
"{'id': None, 'name': 'ETF Daily News'}",MarketBeat News,YieldMax NVDA Option Income Strategy ETF Sees Unusually Large Options Volume (NYSEARCA:NVDY),"YieldMax NVDA Option Income Strategy ETF (NYSEARCA:NVDY – Get Free Report) was the recipient of some unusual options trading on Wednesday. Stock investors bought 53,962 call options on the company. This is an increase of approximately 2,217% compared to the t…",https://www.etfdailynews.com/2025/07/17/yieldmax-nvda-option-income-strategy-etf-sees-unusually-large-options-volume-nysearcanvdy/,https://www.americanbankingnews.com/wp-content/timthumb/timthumb.php?src=https://www.marketbeat.com/logos/yieldmax-nvda-option-income-strategy-etf-logo-1200x675.jpg?v=20250207134949&w=240&h=240&zc=2,2025-07-17T05:19:00Z,"YieldMax NVDA Option Income Strategy ETF (NYSEARCA:NVDY – Get Free Report) was the recipient of some unusual options trading on Wednesday. Stock investors bought 53,962 call options on the company. T… [+2403 chars]"
"{'id': None, 'name': 'BusinessLine'}",Madhu Balaji,ITC Hotels volatile after early 3% gain on strong Q1; brokerages hike target prices,"ITC Hotels stock rises 3% in early trade as Q1 net profit surges 53%, Jefferies and Macquarie lift target to ₹270.",https://www.thehindubusinessline.com/markets/stock-markets/itc-hotels-volatile-after-early-3-gain-on-strong-q1-jefferies-and-macquarie-hike-target-prices/article69821910.ece,https://bl-i.thgim.com/public/incoming/7x4ztv/article69821928.ece/alternates/LANDSCAPE_1200/IMG_exterior-dusk_2_1_949QVG9C.jpg,2025-07-17T05:18:55Z,ITC Hotels stock fluctuated on Thursday after soaring 3 per cent in early trade. This followed a 53.4 per cent y-o-y increase in its consolidated net profit to 133.71 crore for the first quarter this… [+1087 chars]
"{'id': 'the-times-of-india', 'name': 'The Times of India'}",Ritesh Presswala,AWL Agri Business shares surge over 6% on record Q1 revenue,"AWL Agri Business reported its highest-ever Q1 revenue at Rs 17,059 crore, driven by strong edible oil performance. Despite a 24% YoY profit decline, robust top-line growth and retail expansion boosted investor sentiment in Thursday’s trade.",https://economictimes.indiatimes.com/markets/stocks/news/awl-agri-business-shares-surge-over-6-on-record-q1-revenue/articleshow/122615647.cms,"https://img.etimg.com/thumb/msid-122615641,width-1200,height-630,imgsize-3730,overlay-etmarkets/articleshow.jpg",2025-07-17T05:17:39Z,"Shares of AWL Agri Business surged 6.20% to Rs 278 apiece on the BSE in Thursdays trade after the company reported its highest-ever quarterly revenue in the June '25 quarter, signalling strong underl… [+2178 chars]"
"{'id': None, 'name': 'Yahoo Entertainment'}",Ramish Cheema,"KLA Corporation (KLAC) Is One Of The Most Important Companies In America, Says Jim Cramer",We recently published 11 Stocks Jim Cramer Just Discussed As He Shared Why Stocks Are Rising. KLA Corporation (NASDAQ:KLAC) is one of the stocks Jim Cramer...,https://finance.yahoo.com/news/kla-corporation-klac-one-most-051559427.html,https://s.yimg.com/ny/api/res/1.2/D5jczb3wdw.bauSlPoj4gw--/YXBwaWQ9aGlnaGxhbmRlcjt3PTEyMDA7aD02NzM-/https://media.zenfs.com/en/insidermonkey.com/43fb7a3cc803e4b72c713e3ce6039cb5,2025-07-17T05:15:59Z,"We recently published 11 Stocks Jim Cramer Just Discussed As He Shared Why Stocks Are Rising. KLA Corporation (NASDAQ:KLAC) is one of the stocks Jim Cramer recently discussed.
KLA Corporation (NASDA… [+2094 chars]"
"{'id': None, 'name': 'Nep123.com'}",Editor,"Okay, here’s a long, casual, SEO-friendly English title:
Big News! The Dry Port in Birgunj Has Officially Merged With the Customs Office Starting Today, Meaning Easier Import and Export Processes and What You Need to Know!","Big News! Birgunj Dry Port Now Integrated with Customs Department! Hey everyone! Nepali customs news just dropped, and it’s pretty significant for importers and exporters in Nepal! The Birgunj Dry Port, a crucial piece of infrastructure for international trad…",https://nep123.com/okay-heres-a-long-casual-seo-friendly-english-titlebig-news-the-dry-port-in-birgunj-has-officially-merged-with-the-customs-office-starting-today-meaning-easier-import-and-export-processes-and/,https://nep123.com/wp-content/uploads/2025/07/city_road_ghanta.jpg,2025-07-17T05:15:58Z,"Hey everyone! Nepali customs news just dropped, and it’s pretty significant for importers and exporters in Nepal! The Birgunj Dry Port, a crucial piece of infrastructure for international trade, has … [+1848 chars]"
"{'id': None, 'name': 'Yahoo Entertainment'}",Ramish Cheema,"Applied Materials, Inc. (AMAT) “Is About To Have A Renaissance,” Says Jim Cramer","We recently published 11 Stocks Jim Cramer Just Discussed As He Shared Why Stocks Are Rising. Applied Materials, Inc. (NASDAQ:AMAT) is one of the stocks Jim ...",https://finance.yahoo.com/news/applied-materials-inc-amat-renaissance-051550517.html,https://s.yimg.com/ny/api/res/1.2/wOy2B3.sxGrI54JnwY_E9w--/YXBwaWQ9aGlnaGxhbmRlcjt3PTEyMDA7aD02NzM-/https://media.zenfs.com/en/insidermonkey.com/207b5aad170b9e2a9fb492aaeaf0539a,2025-07-17T05:15:50Z,"We recently published 11 Stocks Jim Cramer Just Discussed As He Shared Why Stocks Are Rising. Applied Materials, Inc. (NASDAQ:AMAT) is one of the stocks Jim Cramer recently discussed.
Applied Materi… [+1983 chars]"
"{'id': None, 'name': 'Yahoo Entertainment'}",Ramish Cheema,"T-Mobile US, Inc. (TMUS) “Has Been A Huge, Huge Winner,” Says Jim Cramer","We recently published 14 Stocks Jim Cramer Discussed As He Talked About Record Bitcoin Price. T-Mobile US, Inc. (NASDAQ:TMUS) is one of the stocks Jim Cramer...",https://finance.yahoo.com/news/t-mobile-us-inc-tmus-051530290.html,https://s.yimg.com/ny/api/res/1.2/8lmGSnF7nqdPequUBGTDKQ--/YXBwaWQ9aGlnaGxhbmRlcjt3PTEyMDA7aD02NzM-/https://media.zenfs.com/en/insidermonkey.com/3c0a71fa6ead3853625822027cd43756,2025-07-17T05:15:30Z,"We recently published 14 Stocks Jim Cramer Discussed As He Talked About Record Bitcoin Price. T-Mobile US, Inc. (NASDAQ:TMUS) is one of the stocks Jim Cramer recently discussed.
T-Mobile US, Inc. (N… [+1999 chars]"
"{'id': None, 'name': 'Yahoo Entertainment'}",Ramish Cheema,"AT&T Inc. (T): I’m Not Against It, But T-Mobile’s Been A Winner, Says Jim Cramer",We recently published 14 Stocks Jim Cramer Discussed As He Talked About Record Bitcoin Price. AT&T Inc. (NYSE:T) is one of the stocks Jim Cramer recently...,https://finance.yahoo.com/news/t-inc-t-m-not-051522049.html,https://media.zenfs.com/en/insidermonkey.com/b59e3def8f182d3e4f871bfc8cc254fe,2025-07-17T05:15:22Z,"We recently published 14 Stocks Jim Cramer Discussed As He Talked About Record Bitcoin Price. AT&amp;T Inc. (NYSE:T) is one of the stocks Jim Cramer recently discussed.
AT&amp;T Inc. (NYSE:T) is a m… [+3912 chars]"
"{'id': None, 'name': 'Globalsecurity.org'}",John Pike,Ukraine Leadership Reshuffle Seen Strengthening Trump Administration Ties,A reshuffling of Ukraine's government and diplomatic corps could improve communication with the United States just as President Donald Trump appears to be pivoting toward the embattled country in its more than three-year war with Russia.,https://www.globalsecurity.org/wmd/library/news/ukraine/2025/07/ukraine-250716-rferl03.htm,,2025-07-17T05:13:08Z,"By Todd Prince July 16, 2025
WASHINGTON, D.C. -- A reshuffling of Ukraine's government and diplomatic corps could improve communication with the United States just as President Donald Trump appears … [+5910 chars]"
